{"arcs":[{"id":475,"dst":[73.1781,22.312],"src":[103.412,2.0065],"impact":"opportunity","dst_story":"story:transformer-lead-times-stretch","link_type":"inferred","src_story":"story:johor-datacentre-buildout","confidence":0.55,"dst_country":"region:in","src_country":"region:my"},{"id":485,"dst":[-60.1133,-36.6734],"src":[37.6136,55.7541],"impact":"opportunity","dst_story":"story:argentine-wheat-cargoes-north-africa","link_type":"inferred","src_story":"story:russia-proposes-smaller-export-quota","confidence":0.55,"dst_country":"region:ar","src_country":"region:ru"},{"id":490,"dst":[-73.982,40.7519],"src":[-44.4808,-18.5895],"impact":"risk","dst_story":"story:arabica-nears-record-high","link_type":"reported","src_story":"story:minas-gerais-frost-hits-coffee","confidence":0.85,"dst_country":"region:us","src_country":"region:br"},{"id":494,"dst":[-122.3419,47.5719],"src":[-44.4808,-18.5895],"impact":"opportunity","dst_story":"story:seattle-roaster-value-blend","link_type":"inferred","src_story":"story:minas-gerais-frost-hits-coffee","confidence":0.5,"dst_country":"region:us","src_country":"region:br"},{"id":524,"dst":[72.95,18.95],"src":[4.3314,50.8353],"impact":"risk","dst_story":"story:indian-exporters-margin-squeeze","link_type":"inferred","src_story":"story:cbam-charges-hit-steel-imports","confidence":0.45,"dst_country":"region:in","src_country":"region:be"},{"id":532,"dst":[7.6571,51.6146],"src":[4.9147,52.3519],"impact":"opportunity","dst_story":"story:german-heat-pump-orders-climb","link_type":"inferred","src_story":"story:ttf-gas-prices-rise","confidence":0.5,"dst_country":"region:de","src_country":"region:nl"},{"id":538,"dst":[72.855,19.0189],"src":[-73.982,40.7519],"impact":"opportunity","dst_story":"story:rupee-firms-on-softer-dollar","link_type":"inferred","src_story":"story:treasury-yields-drop","confidence":0.6,"dst_country":"region:in","src_country":"region:us"},{"id":539,"dst":[106.8275,-6.1725],"src":[-73.982,40.7519],"impact":"opportunity","dst_story":"story:rupiah-recovers-food-importers","link_type":"inferred","src_story":"story:treasury-yields-drop","confidence":0.55,"dst_country":"region:id","src_country":"region:us"},{"id":549,"dst":[75.808,26.9231],"src":[120.298,31.5819],"impact":"opportunity","dst_story":"story:rooftop-solar-inquiries-jump","link_type":"inferred","src_story":"story:solar-module-prices-slide","confidence":0.45,"dst_country":"region:in","src_country":"region:cn"},{"id":568,"dst":[100.034,14.4298],"src":[77.2,28.6],"impact":"opportunity","dst_story":"story:thai-exporters-raise-rice-offers","link_type":"inferred","src_story":"story:india-signals-rice-export-curbs","confidence":0.6,"dst_country":"region:th","src_country":"region:in"},{"id":574,"dst":[139.7495,35.687],"src":[-73.982,40.7519],"impact":"opportunity","dst_story":"story:yen-jumps-on-hike-odds","link_type":"inferred","src_story":"story:treasury-yields-drop","confidence":0.55,"dst_country":"region:jp","src_country":"region:us"},{"id":575,"dst":[-99.1329,19.4444],"src":[139.7495,35.687],"impact":"risk","dst_story":"story:carry-unwind-hits-peso-rand","link_type":"inferred","src_story":"story:yen-jumps-on-hike-odds","confidence":0.6,"dst_country":"region:mx","src_country":"region:jp"},{"id":583,"dst":[73.1781,22.312],"src":[-100.3319,25.6719],"impact":"opportunity","dst_story":"story:transformer-lead-times-stretch","link_type":"inferred","src_story":"story:monterrey-parks-order-private-substations","confidence":0.45,"dst_country":"region:in","src_country":"region:mx"},{"id":611,"dst":[66.9881,24.8719],"src":[101.698,3.1686],"impact":"risk","dst_story":"story:karachi-cooking-oil-prices-rise","link_type":"reported","src_story":"story:kl-palm-futures-climb","confidence":0.8,"dst_country":"region:pk","src_country":"region:my"},{"id":612,"dst":[29.948,31.202],"src":[101.698,3.1686],"impact":"risk","dst_story":"story:egypt-edible-oil-importers-costs","link_type":"inferred","src_story":"story:kl-palm-futures-climb","confidence":0.6,"dst_country":"region:eg","src_country":"region:my"},{"id":614,"dst":[29.948,31.202],"src":[43.33,12.58],"impact":"risk","dst_story":"story:egypt-edible-oil-importers-costs","link_type":"inferred","src_story":"story:red-sea-attacks-reroute","confidence":0.45,"dst_country":"region:eg","src_country":"region:ye"},{"id":622,"dst":[-118.27,33.74],"src":[-79.68,9.08],"impact":"opportunity","dst_story":"story:west-coast-ports-rail-gain","link_type":"inferred","src_story":"story:panama-canal-cuts-draft-and-slots","confidence":0.6,"dst_country":"region:us","src_country":"region:pa"},{"id":623,"dst":[-81.14,32.13],"src":[-79.68,9.08],"impact":"opportunity","dst_story":"story:savannah-gains-gulf-boxes","link_type":"inferred","src_story":"story:panama-canal-cuts-draft-and-slots","confidence":0.5,"dst_country":"region:us","src_country":"region:pa"},{"id":633,"dst":[78.478,17.4019],"src":[9.6783,50.9617],"impact":"opportunity","dst_story":"story:air-freight-pharma-shift","link_type":"inferred","src_story":"story:europe-generic-antibiotic-gaps","confidence":0.5,"dst_country":"region:in","src_country":"region:de"},{"id":648,"dst":[4.14,51.95],"src":[122.07,30.63],"impact":"risk","dst_story":"story:rotterdam-congestion","link_type":"inferred","src_story":"story:asia-europe-rates-jump","confidence":0.6,"dst_country":"region:nl","src_country":"region:cn"},{"id":649,"dst":[72.95,18.95],"src":[122.07,30.63],"impact":"risk","dst_story":"story:indian-exporters-margin-squeeze","link_type":"reported","src_story":"story:asia-europe-rates-jump","confidence":0.7,"dst_country":"region:in","src_country":"region:cn"},{"id":650,"dst":[78.478,17.4019],"src":[122.07,30.63],"impact":"opportunity","dst_story":"story:air-freight-pharma-shift","link_type":"inferred","src_story":"story:asia-europe-rates-jump","confidence":0.55,"dst_country":"region:in","src_country":"region:cn"},{"id":670,"dst":[-100.904,20.8141],"src":[121,24.78],"impact":"risk","dst_story":"story:guanajuato-line-idles-on-chips","link_type":"inferred","src_story":"story:hsinchu-fabs-safety-inspections","confidence":0.6,"dst_country":"region:mx","src_country":"region:tw"},{"id":682,"dst":[136.913,35.1569],"src":[-77.0114,38.9015],"impact":"risk","dst_story":"story:japanese-carmaker-warns-on-yen","link_type":"inferred","src_story":"story:us-widens-auto-parts-tariffs","confidence":0.45,"dst_country":"region:jp","src_country":"region:us"},{"id":698,"dst":[73.1781,22.312],"src":[106.493,21.3512],"impact":"opportunity","dst_story":"story:transformer-lead-times-stretch","link_type":"inferred","src_story":"story:northern-vietnam-power-cuts","confidence":0.4,"dst_country":"region:in","src_country":"region:vn"}],"events":[{"id":"story:us-hiring-slows","lat":38.9015,"lon":-77.0114,"impact":"neutral","sectors":["finance","consumer"],"analysed":true,"headline":"US hiring slows more than expected as payroll gains cool","magnitude":4,"country_id":"region:us","first_seen":"2026-10-22T01:20:23+00:00","importance":87.5},{"id":"story:us-india-first-stage-deal-close","lat":28.6,"lon":77.2,"impact":"opportunity","sectors":["logistics-trade","manufacturing"],"analysed":true,"headline":"Officials signal a first-stage US–India trade deal is close","magnitude":4,"country_id":"region:in","first_seen":"2026-10-21T23:20:23+00:00","importance":85},{"id":"story:china-signals-wider-rare-earth-controls","lat":39.9308,"lon":116.3863,"impact":"risk","sectors":["manufacturing","tech"],"analysed":true,"headline":"China's commerce ministry signals rare-earth licensing could widen","magnitude":4,"country_id":"region:cn","first_seen":"2026-10-22T03:20:23+00:00","importance":84.5},{"id":"story:yen-jumps-on-hike-odds","lat":35.687,"lon":139.7495,"impact":"opportunity","sectors":["finance","energy","consumer"],"analysed":true,"headline":"Yen jumps as markets price a Japanese rate rise","magnitude":4,"country_id":"region:jp","first_seen":"2026-10-22T04:20:23+00:00","importance":84.3},{"id":"story:usmca-review-turns-to-autos","lat":45.4186,"lon":-75.702,"impact":"neutral","sectors":["logistics-trade","manufacturing"],"analysed":true,"headline":"USMCA review talks turn to car content rules","magnitude":4,"country_id":"region:ca","first_seen":"2026-10-21T21:20:23+00:00","importance":84.1},{"id":"story:arabica-nears-record-high","lat":40.7519,"lon":-73.982,"impact":"risk","sectors":["agri-food","consumer"],"analysed":true,"headline":"Arabica futures climb toward their record as Brazil trims its crop estimate","magnitude":4,"country_id":"region:us","first_seen":"2026-10-22T03:20:23+00:00","importance":83.9},{"id":"story:boj-signals-hike-readiness","lat":35.687,"lon":139.7495,"impact":"neutral","sectors":["finance"],"analysed":true,"headline":"Bank of Japan signals it is ready to raise rates","magnitude":4,"country_id":"region:jp","first_seen":"2026-10-21T18:20:23+00:00","importance":83.9},{"id":"story:opec-plus-signals-longer-cuts","lat":48.202,"lon":16.3647,"impact":"risk","sectors":["energy"],"analysed":true,"headline":"OPEC+ delegates signal output cuts will be extended","magnitude":4,"country_id":"region:at","first_seen":"2026-10-22T02:20:23+00:00","importance":83.8},{"id":"story:delhi-peak-power-record","lat":28.6719,"lon":77.2281,"impact":"risk","sectors":["energy"],"analysed":true,"headline":"Delhi's peak power demand breaks its all-time record","magnitude":3,"country_id":"region:in","first_seen":"2026-10-22T11:44:23+00:00","importance":74.5},{"id":"story:treasury-yields-drop","lat":40.7519,"lon":-73.982,"impact":"opportunity","sectors":["finance"],"analysed":true,"headline":"Short-term Treasury yields fall as investors price a Fed cut","magnitude":3,"country_id":"region:us","first_seen":"2026-10-22T03:20:23+00:00","importance":74.4},{"id":"story:india-retail-inflation-rises","lat":28.6,"lon":77.2,"impact":"risk","sectors":["finance","consumer","agri-food"],"analysed":true,"headline":"India's retail inflation rises as vegetable and cereal prices climb","magnitude":3,"country_id":"region:in","first_seen":"2026-